{
  "$schema": "https://json-schema.org/draft/2020-12/schema",
  "$id": "oreflow-studies-v1",
  "title": "oreflow-studies-v1",
  "type": "object",
  "properties": {
    "schema": {
      "const": "oreflow.studies/v1",
      "type": "string"
    },
    "engine_version": {
      "type": "string"
    },
    "contract_digest": {
      "type": "string"
    },
    "switches": {
      "type": "object"
    },
    "cases": {
      "type": "object"
    }
  },
  "required": [
    "schema",
    "engine_version",
    "contract_digest",
    "switches",
    "cases"
  ],
  "additionalProperties": true
}
