{"schema":"oreflow.studies/v1","engine_version":"0.10.001","contract_digest":"0d2b65d272f3abcc6adffbf0f734c985cb002ab5cb665c109b8e8e9e31cecbd7","switches":{"entrainment":{"removes":{"en":"water-borne recovery of fine particles (Savassi)","es":"la recuperación por arrastre de partículas finas (Savassi)"}},"composite_classes":{"removes":{"en":"composite particles: every grain of a valuable mineral liberated","es":"las partículas mixtas: cada grano de un mineral valioso liberado"}},"cleaner_recirculation":{"removes":{"en":"the return of the cleaner tail to the rougher feed","es":"el retorno de la cola del cleaner a la alimentación rougher"}},"regrind":{"removes":{"en":"the regrind of the rougher concentrate","es":"la remolienda del concentrado rougher"}},"gravity_bleed":{"removes":{"en":"the gravity bleed of the cyclone underflow","es":"la purga gravimétrica de la descarga del ciclón"}}},"cases":{"copper_porphyry_soft":{"ablations":{"entrainment":{"status":"computed","on":{"recovery_pct":92.21261928007924,"concentrate_grade":26.415673447496314,"specific_energy_total_kwh_t":10.394628844259875,"recovered_primary_tph":4.913088355242623},"off":{"recovery_pct":92.26464717161477,"concentrate_grade":26.41427356681537,"specific_energy_total_kwh_t":10.09498679492384,"recovered_primary_tph":4.915860401303636},"delta":{"recovery_pct":0.05202789153553056,"concentrate_grade":-0.0013998806809425446,"specific_energy_total_kwh_t":-0.2996420493360361,"recovered_primary_tph":0.0027720460610130004},"detail":{"on":{"rougher_mass_pull_pct":9.338426760696741,"cleaner_recycle_tph":53.647350163512534,"cleaner_residence_min":15.440911881930758,"cleaner_recovery_pct":91.38597878208174},"off":{"rougher_mass_pull_pct":4.919409921778874,"cleaner_recycle_tph":17.678824041640013,"cleaner_residence_min":16.15895968952524,"cleaner_recovery_pct":91.90608115772119}},"flags":[],"balance":9.296267459527975e-14},"composite_classes":{"status":"computed","on":{"recovery_pct":92.21261928007924,"concentrate_grade":26.415673447496314,"specific_energy_total_kwh_t":10.394628844259875,"recovered_primary_tph":4.913088355242623},"off":{"recovery_pct":98.27889490152236,"concentrate_grade":33.28314547932799,"specific_energy_total_kwh_t":10.324821120097106,"recovered_primary_tph":5.236299520353112},"delta":{"recovery_pct":6.0662756214431255,"concentrate_grade":6.867472031831678,"specific_energy_total_kwh_t":-0.0698077241627697,"recovered_primary_tph":0.3232111651104894},"detail":{"on":{"rougher_mass_pull_pct":9.338426760696741,"cleaner_recycle_tph":53.647350163512534,"cleaner_residence_min":15.440911881930758,"cleaner_recovery_pct":91.38597878208174},"off":{"rougher_mass_pull_pct":8.299170164148316,"cleaner_recycle_tph":48.00549695959592,"cleaner_residence_min":16.16732376468582,"cleaner_recovery_pct":95.2082450619304}},"flags":[],"balance":1.4270066609848675e-13},"cleaner_recirculation":{"status":"computed","on":{"recovery_pct":92.21261928007924,"concentrate_grade":26.415673447496314,"specific_energy_total_kwh_t":10.394628844259875,"recovered_primary_tph":4.913088355242623},"off":{"recovery_pct":86.85284867020117,"concentrate_grade":26.388386679485613,"specific_energy_total_kwh_t":10.375965479071322,"recovered_primary_tph":4.627519777148319},"delta":{"recovery_pct":-5.359770609878069,"concentrate_grade":-0.027286768010700513,"specific_energy_total_kwh_t":-0.01866336518855327,"recovered_primary_tph":-0.2855685780943036},"detail":{"on":{"rougher_mass_pull_pct":9.338426760696741,"cleaner_recycle_tph":53.647350163512534,"cleaner_residence_min":15.440911881930758,"cleaner_recovery_pct":91.38597878208174},"off":{"rougher_mass_pull_pct":9.723178799786668,"cleaner_recycle_tph":0.0,"cleaner_residence_min":16.025749775490134,"cleaner_recovery_pct":92.03755107952618}},"flags":[],"balance":2.5173058581600977e-15},"regrind":{"status":"computed","on":{"recovery_pct":92.21261928007924,"concentrate_grade":26.415673447496314,"specific_energy_total_kwh_t":10.394628844259875,"recovered_primary_tph":4.913088355242623},"off":{"recovery_pct":88.34977701393134,"concentrate_grade":23.02650876530471,"specific_energy_total_kwh_t":9.792574751084121,"recovered_primary_tph":4.707276119302263},"delta":{"recovery_pct":-3.8628422661478936,"concentrate_grade":-3.3891646821916055,"specific_energy_total_kwh_t":-0.6020540931757541,"recovered_primary_tph":-0.20581223594035958},"detail":{"on":{"rougher_mass_pull_pct":9.338426760696741,"cleaner_recycle_tph":53.647350163512534,"cleaner_residence_min":15.440911881930758,"cleaner_recovery_pct":91.38597878208174},"off":{"rougher_mass_pull_pct":9.688771826130491,"cleaner_recycle_tph":54.60705357677678,"cleaner_residence_min":14.795972853971769,"cleaner_recovery_pct":81.56715974051349}},"flags":[],"balance":1.2791806265403413e-13},"gravity_bleed":{"status":"not_applicable"}},"seed_study":{"seeds":[101,202,303,404,505,606,707,808],"samples":128,"design":"Latin hypercube","generator":"SplitMix64","per_seed":[{"seed":101,"recovery_pct":{"p05":89.21629740188231,"p50":91.99641081394273,"p95":94.0252370417414},"concentrate_grade":{"p05":25.00377186900676,"p50":26.30074443481567,"p95":27.766193248231666},"all_constraints":0.8203125},{"seed":202,"recovery_pct":{"p05":89.01868529130897,"p50":91.98364804416494,"p95":94.03488793289262},"concentrate_grade":{"p05":24.77100294345795,"p50":26.510747439381927,"p95":27.53463233675255},"all_constraints":0.8203125},{"seed":303,"recovery_pct":{"p05":89.04229536634189,"p50":91.98503988370493,"p95":93.91491832687767},"concentrate_grade":{"p05":24.7943064808349,"p50":26.449735560832366,"p95":27.723245564715313},"all_constraints":0.8125},{"seed":404,"recovery_pct":{"p05":89.36763882700333,"p50":91.97567221993236,"p95":93.8758401800728},"concentrate_grade":{"p05":24.71201371673505,"p50":26.394771762428825,"p95":27.81382386853071},"all_constraints":0.8125},{"seed":505,"recovery_pct":{"p05":89.07924203745625,"p50":92.03595521895605,"p95":93.74544358997568},"concentrate_grade":{"p05":25.02815849122942,"p50":26.37666402307569,"p95":27.825479729896596},"all_constraints":0.8203125},{"seed":606,"recovery_pct":{"p05":89.08732615867507,"p50":91.94407682039412,"p95":93.799518131297},"concentrate_grade":{"p05":25.00434626905534,"p50":26.38722753327123,"p95":27.69952951330403},"all_constraints":0.8125},{"seed":707,"recovery_pct":{"p05":89.37417119373016,"p50":92.09247300730375,"p95":94.00775343306316},"concentrate_grade":{"p05":24.804677713760707,"p50":26.516438282747053,"p95":27.59988872983366},"all_constraints":0.8125},{"seed":808,"recovery_pct":{"p05":89.29499627917895,"p50":91.91707686540201,"p95":93.9487970368759},"concentrate_grade":{"p05":24.80544058928521,"p50":26.408154914421168,"p95":27.72107101816044},"all_constraints":0.8125}],"spread":{"recovery_pct":{"p05":0.3554859024211936,"p50":0.1753961419017429,"p95":0.2894443429169371},"concentrate_grade":{"p05":0.3161447744943686,"p50":0.2156938479313837,"p95":0.29084739314404473},"all_constraints":0.0078125}}},"copper_porphyry_hard":{"ablations":{"entrainment":{"status":"computed","on":{"recovery_pct":93.27399826596478,"concentrate_grade":26.169356623036133,"specific_energy_total_kwh_t":16.128598092408794,"recovered_primary_tph":2.473626434013386},"off":{"recovery_pct":93.34232540304923,"concentrate_grade":26.254547845682662,"specific_energy_total_kwh_t":15.818828366048017,"recovered_primary_tph":2.4754384696888656},"delta":{"recovery_pct":0.06832713708445226,"concentrate_grade":0.08519122264652879,"specific_energy_total_kwh_t":-0.30976972636077704,"recovered_primary_tph":0.0018120356754796063},"detail":{"on":{"rougher_mass_pull_pct":8.488090398589685,"cleaner_recycle_tph":36.97538764472018,"cleaner_residence_min":15.251243202597118,"cleaner_recovery_pct":91.5742260999465},"off":{"rougher_mass_pull_pct":3.859908892004571,"cleaner_recycle_tph":10.66873034966461,"cleaner_residence_min":15.965448740623145,"cleaner_recovery_pct":92.08098199075205}},"flags":[],"balance":7.244749462652001e-14},"composite_classes":{"status":"computed","on":{"recovery_pct":93.27399826596478,"concentrate_grade":26.169356623036133,"specific_energy_total_kwh_t":16.128598092408794,"recovered_primary_tph":2.473626434013386},"off":{"recovery_pct":98.27380560583393,"concentrate_grade":32.03987046614703,"specific_energy_total_kwh_t":16.091252711573006,"recovered_primary_tph":2.606221324666716},"delta":{"recovery_pct":4.99980733986915,"concentrate_grade":5.870513843110896,"specific_energy_total_kwh_t":-0.03734538083578798,"recovered_primary_tph":0.13259489065332986},"detail":{"on":{"rougher_mass_pull_pct":8.488090398589685,"cleaner_recycle_tph":36.97538764472018,"cleaner_residence_min":15.251243202597118,"cleaner_recovery_pct":91.5742260999465},"off":{"rougher_mass_pull_pct":7.917650290728131,"cleaner_recycle_tph":35.01833945502511,"cleaner_residence_min":15.647587061094308,"cleaner_recovery_pct":95.2617298820127}},"flags":[],"balance":1.4851736398436604e-13},"cleaner_recirculation":{"status":"computed","on":{"recovery_pct":93.27399826596478,"concentrate_grade":26.169356623036133,"specific_energy_total_kwh_t":16.128598092408794,"recovered_primary_tph":2.473626434013386},"off":{"recovery_pct":88.18622957470966,"concentrate_grade":26.41189298563634,"specific_energy_total_kwh_t":16.112170741899966,"recovered_primary_tph":2.3386988083213},"delta":{"recovery_pct":-5.087768691255121,"concentrate_grade":0.24253636260020528,"specific_energy_total_kwh_t":-0.016427350508827487,"recovered_primary_tph":-0.13492762569208594},"detail":{"on":{"rougher_mass_pull_pct":8.488090398589685,"cleaner_recycle_tph":36.97538764472018,"cleaner_residence_min":15.251243202597118,"cleaner_recovery_pct":91.5742260999465},"off":{"rougher_mass_pull_pct":8.829694229033228,"cleaner_recycle_tph":0.0,"cleaner_residence_min":15.813597135699354,"cleaner_recovery_pct":92.33416047274075}},"flags":[],"balance":6.148830567424225e-15},"regrind":{"status":"computed","on":{"recovery_pct":93.27399826596478,"concentrate_grade":26.169356623036133,"specific_energy_tota